"SR_wojzju3U";"Уловки нечестных риэлторов и агентов по недвижимости";"Агентство недвижимости Альтернативный Вариант - a-variant.ru Продажа и аренда квартир в Москве и Московской области «Альтернативный вариант» - агентство недвижимости, в котором работают риэлторы огромным опытном работы от 5 лет и более,с юридическим, психологическим или педагогическим образованием, специализирующиеся в самых трудных областях вторичного рынка продажах с одновременной покупкой альтернативного вариантов, разъездах, разменах и расселениях коммунальных квартир. Следует учесть, что если даже продавец назначил низкую цену на жилую площадь, она останется таковой и при подписании договора. Дело в том, что многие одиночные риелторы и фирмы назначают солидную комиссию за свои услуги. Раньше, когда рынок недвижимости только развивался, назначение вознаграждения считалось нормальной практикой среди риелторов. Как правило, в бумагах даже фигурировал пункт, информирующий покупателя о дополнительных взносах. Сегодня же ситуация в корне изменилась. Так, обращаясь в агентство недвижимости ""Альтернативный вариант"" вы лишаетесь комиссионного бремени, так как специалисты получают своё вознаграждение в виде процентов от сделки. То есть, само агентство фактически, оплачивает их услуги. Безусловно, клиенты получают явную выгоду - как в виде сэкономленных денежных средств, так и дополнительных квадратных метров. Уловки нечестных риелторов и агентов по недвижимости делают продажа аренда обмен квартир в Москве и Московской области очень рискованным занятием. Квартиры и дпугая <b>...</b>";"01/02/2012";4.7777777;"http://i.ytimg.com/vi/SR_wojzju3U/hqdefault.jpg";153;414;"покупка квартиры в москве";"с удовольствием бы посмотрела про реальные случаи мошенничества в сфере недвижимости, как говорится Предупреждён - значит﻿ вооружён";"актуально﻿";"Часто﻿ риелторы и мелкие агентства настаивают на внесении авансового платежа за неоказанную услугу. Стоит насторожится, ведь они могут и не выполнить свои обязательства. Крупные компании, как правило, не требуют внесения средств раньше выполнения работы."
"oQ1ygAgIs24";"Жилье в Москве, Квартиры в Москве недорого: жилой комплекс Войковский мкр 9-10 - видео от remoney.ru";"Это новый жилой комплекс в Москве, видео предоставлено первым видеопорталом о недвижимости и деньгах remoney.ru";"22/08/2008";5;"http://i.ytimg.com/vi/oQ1ygAgIs24/hqdefault.jpg";87;753;"покупка квартиры в москве";"Да, хороший домик. Только﻿ цены на квартиры аховые. Не укупишь. Люди, посмотрите ролики eurruss на сайтах youtube или livejourmal.Подумайте, может это действительно реально?"
"PCGlXoDyv8M";"Инвестиции в недвижимость и ипотека в России";"Ведущие эксперты рынка жилья делятся своими наблюдениями за рынком недвижимости России. Расскажут всю правду о грядущем повышении цен на жилье, объяснят в каком банке лучше брать ипотечный кредит, как купить квартиру в Москве и как не попасть в руки мошенникам и вообще нужно сейчас менять жилплощадь или лучше подождать до лучших времен. полная версия вебинара: video.yandex.ua";"17/06/2011";5;"http://i.ytimg.com/vi/PCGlXoDyv8M/hqdefault.jpg";891;832;"покупка квартиры в москве";"webhata.ru Рынок Недвижимости России.﻿ Покупка,﻿ Продажа, Аренда.﻿";"webhata.ru Рынок﻿ Недвижимости. Покупка, Продажа, Аренда.";"Если Вам нужно приобрести (сделать) квартиру. Вы живете в Москве (МО) или Питере. В другом городе - только по новостройкам. 
Не ипотека и не млм - упаси боже!
Провожу бесплатную консультацию для вас.
Пишите в личку, если вам действительно нужно приобрести квартиру.﻿ Только с серьезными намерениями.
Скайп - rusrega";"Поможем на хороших условиях﻿ инвестировать в долгоиграющий проект! Всё об этом на нашем канале!"
"GYFCvpouvjo";"Обманутые дольщики Москвы. Случай с компаний СУ-155";"Обманутые дольщики строительства жилищного кооператива «Новая Трехгорка» провели 25 апреля митинг в защиту своих прав на городском стадионе Одинцово. На митинге собрались около 200 человек. На территории жилищного кооператива планируется построить жилья общей площадью 500 тысяч кв. м. (это примерно 16 тысяч жителей). Продажи квартир в жилищном кооперативе начались в 2005 году. Обещанный тогда срок заселения — 2007 год. Квартиры, которых люди ждут уже не первый год, оплачены полностью, а у многих за счет кредитных средств. Застройщиком жилищного кооператива «Новая Трехгорка» выступает компания ЗАО ""СУ-155"".";"13/05/2010";5.0;"http://i.ytimg.com/vi/GYFCvpouvjo/hqdefault.jpg";534;1687;"покупка квартиры в москве";"webhata.ru﻿﻿ Рынок Недвижимости﻿﻿ России. Покупка,﻿ Продажа, Аренда.﻿﻿";"СУ-155, компания ЗАО СУ-155, обманутые дольщики, Новая трехгорка, долгострой, Москва, Одинцово, обманутые дольщики Москва, су-155 новостройки, су-155 продажа квартир, су-155, су 155, зао су 155, су 155 новостройки, отзывы су 155, су 155 продажа﻿ квартир";"СУ-155, компания﻿ ЗАО СУ-155, обманутые дольщики, Новая трехгорка, долгострой, Москва, Одинцово, обманутые дольщики Москва, су-155 новостройки, су-155 продажа квартир, су-155, су 155, зао су 155, су 155 новостройки, отзывы су 155, су 155 продажа квартир";"строительное управление СУ-155, СУ155 Красногорье, Три капитана И-155,Москва су-155 отзывы, су-155 сайт, су-155 трехгорка, Москва су-155﻿ новостройки, зао су-155, су 155 балашиха парк, СУ-155 информация, дольщики Москва, новостройки в Москве, су 155 продажа квартир в Москве"
