"aT0Nq6jUl2w";"Купить квартиру.wmv";"Купить квартиру Покупка квартиры без ипотеки. Наболевший квартирный вопрос. Как приобрести квартиру без банковского процента? При покупке квартиры можно экономить миллионы рублей. Для этого надо обойтись без ипотеки. Существует другая альтернативная система приобретения жилья. Есть возможность взять беспроцентную ссуду для покупки жилья с рассрочкой до 25 лет. Это дешевле, чем аренда жилья. Ипотечный кредит разорителен при погашении ипотеки. Можно приобрести квартиру значительно выгоднее. Дешевые платежи, без процентов по ипотечному кредиту. Калькулятор, сравнение цены, квартиры в Москве, квартиры в Подмосковье и не только. Приобретение квартиры без лишних трат. Оформление покупки квартиры, договор на покупку квартиры, условия погашения кредита. www.dombezipoteki.ru.";"15/02/2012";4.6923075;"http://i.ytimg.com/vi/aT0Nq6jUl2w/hqdefault.jpg";79;1387;"покупка квартиры в москве";"webhata.ru﻿ Рынок Недвижимости России.﻿ Покупка,﻿ Продажа, Аренда.﻿﻿";"Если Вам нужно приобрести (сделать) квартиру. Вы живете в Москве (МО) или Питере. В другом городе - только по новостройкам. 
Не ипотека и не млм - упаси боже!
Провожу бесплатную консультацию для вас.
Пишите в личку, если вам действительно нужно приобрести квартиру. Только с серьезными намерениями.
Скайп -﻿ rusrega";"продам 1 к кв в москве обращатся в личку не﻿ посредник!!!"
"p9wsHyLyFIw";"Продажа обмен и аренда квартир в Москве и области";"Агентство недвижимости Альтернативный Вариант - a-variant.ru Продажа и аренда квартир в Москве и Московской области Вас приветствует московское агентство недвижимости Альтернативный вариант. Неудачные риэлторы говорят,что рынок стоит и квартиры не продаются. В нашем агентстве недвижимости квартиры наших клиентов продаются и меняются быстро,с гарантией и с невысокой агентской комиссией. Если вам нужно продать или обменять квартиру и быстрее получить результат-новую квартиру или деньги-звоните в агентство недвижимости Альтернативный вариант по тел.8-499-506-73-55 или оставляйте заявку на нашем сайте. База квартир агентства недвижимости Альтернативный вариант ежедневно пополняется и содержит самую свежую и актуальную информацию по теме продаж обмен и аренда квартир в Москве и области с подробным описанием и фото каждого объекта.";"03/02/2012";4.6363635;"http://i.ytimg.com/vi/p9wsHyLyFIw/hqdefault.jpg";233;568;"покупка квартиры в москве";"ПОЛНЫЙ КОМПЛЕКС УСЛУГ ПО ОТДЕЛКЕ КВАРТИР, Коттеджей, Офисов в Москве
• электромонтажные работы (любые); 
• сантехнические работы; 
• штукатурно-малярные работы; 
•﻿ монтаж теплых полов; 
• стяжка, наливной пол; 
• настил полов (все виды); 
• плиточные работы (все виды); 
• работа с гипсокартонном (любая); 
• установка межкомнатных дверей; 

• ВСЕГДА Профессиональный подход, Качество,  Договор,Сроки, Гарантия. 

Тел. 89651794955 Григорий
Тел. 89629434634 Рафаэль";"продам 1 к кв в москве метро пражская Ул красного маяка д.1 корп.2  5-й этаж в 9-ти этажном панельном доме тихий зеленый спокойный чистый двор район все в шаговой доступности детсад торговые центры чистая продажа документы готовы (ипотека) обращаться в личку не посредник!!!﻿";"Помогите с вопросом (чтобы себя обезапасить): Хочу купить квартиру 
1- Какие налоги мне нужно заплатить (если таковые есть)?
2- Какие документы мне нужно требовать с продавца?
3- И какие приблизительно сроки полного оформления﻿ покупки?
Спасибо";"Помогите советом: каким образом узнать реальную стоимость квартиры. В газете ""из рук в руки"" цена аналогичной﻿ квартиры в данном районе колеблется от 5 500 до 7 200 тыс рублей. Или узнать цену можно, только опубликовав объявления о продаже? Но решение о продаже еще не принято и публиковать ложные объявления не хочется. Совсем запутался в ситуации.";"Хорошо бы добавить в видео статистики -﻿ среднюю цену метра итд"
"VeatWCGSz3A";"Ипотечный кредит, программа, брокер от специалистов";"Агентство недвижимости Альтернативный Вариант - a-variant.ru Продажа и аренда квартир в Москве и Московской области Ипотека является одним из ведущих направлений, на котором специализируется наше агентство. За последнее время привлечение при покупке недвижимости ипотечных средств банка стало набирать популярность в нашей стране, что доказывает заинтересованность Россиян в приобретении нового жилья в короткие сроки. Существует огромное количество банков и ипотечных программ и чтобы в них разобраться, нужен хороший специалист, который подберет выгодный для ВАС банк. Ипотечные программы корректируются достаточно часто, но наши сотрудники регулярно знакомятся с новинками, оперативно высылаемыми банками-партнерами. Наше агентство гарантирует чистоту и прозрачность сделки. Четко соблюдает технологию безопасности сделки и Вы всегда сможете контролировать каждый ее этап и получать всю необходимую, в том числе и консультативную, помощь. Взять ипотечный кредит или программу поможет вам профессиональный брокер от специалистов, а так же продажа и аренда квартир в Москве и Московской области. Продажа и покупка абсолютно любой недвижимости в Москве и МО. Агентство недвижимости Альтернативный Вариант поможет с продам квартиру Москва или куплю квартиру Москва. Порядок получения кредита от профессионалов.";"19/03/2012";4.7777777;"http://i.ytimg.com/vi/VeatWCGSz3A/hqdefault.jpg";213;289;"покупка квартиры в москве";"После снижения процентных ставок и размера первого взноса ипотечные кредиты становятся более доступными. Это приводит к резкому увеличению покупательского спроса. Но продавцов больше не становится, а следовательно повышается цена квартиры. В итоге, применительно к Москвскому региону понятие ""доступное жилье""﻿ является иллюзией.";"Можно ли﻿ брать одновременно два ипотечных кредита в разных банках на две разные квартиры? Есть ли какие-то ограничения?"
"JIYvSWHl6zY";"Дом в США или квартира в Москве";"Июньская (2007) встреча Клуба фундаментальных инвесторов. Что можно купить за стоимость московской квартиры? Дом в Небраске с большим участком около 200 тыс. долларов Чем дом там отличается от квартиры здесь? Под какие проценты выдаются ипотечные кредиты в США?";"14/03/2008";3.6666667;"http://i.ytimg.com/vi/JIYvSWHl6zY/hqdefault.jpg";522;11378;"покупка квартиры в москве";"webhata.ru﻿ Рынок Недвижимости﻿﻿ России. Покупка,﻿﻿ Продажа, Аренда.﻿﻿";"Я не могу понять как можно сравнивать цены в Небраске﻿ и Москве? 
Корректней сравнить цену  в колхозной Небраске и Урюпинске.";"то что написал чудак у﻿ которого вы спрашиваете-враньё голимое, причём от начала до конца.";"вы сравните цену двушки в Москве с ценой двушки в Нью-йорке, херли вы с периферией сравниваете? в пригороде Москвы тоже можно дом купить за 200 тыс баков а в центральной России два или три дома. Но как﻿ и в России в центре Нью-йорка цены не меньше - все одинакова - на самом деле различия минимальны. Более того - у вас дома там все деревянные в основном - а у нас кирпичные = а это две большие разницы.";"пенсия в Китае есть,﻿ но﻿ только у мужчин ;)";"пенсия в Китае﻿ есть, но только у мужчин ;)";"квартира в Москве - весело, но хуевая страна. дом﻿ в в Небраске - скучно, но хорошая страна.";"В Таиланде квартира из трех комнат-15 штук,﻿ айда туда!";"﻿ Вот,вот.";"Нельзя сравнивать цены на квартиру в Москве ﻿ в каком-либо Техасе.Цены надо сравнивать Москву с Нью Йорком и тд.";"А что мешает? Боязнь сделать такой необычный поворот﻿  в своей жизни?";"бля я покупаю однокомнатную квартиру под екатеринбургом в какой то ебанной провинций и стоят эти 30 квадратов полтора миллиона рублей, причем жилая﻿ площадь составляет всего то 15 или 19 квадратов. Как же хочется отсюда свалить.";"Америка надула очередной пузырь ,в том числе ипотечный . Долг за последний 2010 год увеличился у неё на 4 млрд.! Эту страну ждёт ДЕФОЛТ . Тогда будете покупать легко там недвижку под 1,5-2% годовых. Делайте проще ,если у вас есть 50 т.баков ,вас легко примут в Канаде (почти Россия,только чистая).
И под закусь- В России нет пенсии для 99% населения !!! проснитесь,люди! Имеют пенсии феделалы: депутаты,силовики,судьи и﻿ прочяя ""элитно-бюджетная"" жижа.";"Помощь. Кредит 17%. М﻿ МО.﻿ Без справок﻿ и﻿ поручителей. Консалтинг 25%.﻿ Другие﻿ варианты.﻿﻿ (495)2200660﻿ 2200660@mail.ru";"В КИТАЕ ЕСТЬ ПЕНСИЯ...
ПЕНСИИ НЕТ ТОЛЬКО У ФЕРМЕРОВ...МНЕ ЭТО КИТАЯНКА﻿ ГОВОРИЛА";"надо сравнивать московскую область и пригород Нью Йорка!!!!! чё вы херню порите про﻿ техас, небраску???!!!";"Я вам говорил немедленно продавайте ваши квартиры и покупайте во Флориде Я например купил 12 соток в элитном месте 1.5 года назад за 7 кусков а продавец купил﻿ в 2005 за 96 кусков Как банки начнут давать опять кредиты цены вернутся на свое место";"А как нынешняя экономическая﻿ ситуация повлияла на цены в Москве?";"В Москве скоро тоже будут налоги, это вообще ни куда не﻿ годится чтобы какие то газовые камеры стоили  миллионы";"Если вы﻿ сами не проживаете здесь, то можно сдавать в аренду и таким образом покрывать расходы и, в зависимости от суммы ипотеки, возможно даже получать с аренды наличные.
 !!! Ну не принимают они 500 слов! Пришлось разбить мой ответ на множество ответиков!!!";"Не надо забывать что мы платим налоги на﻿ недвижимость и нужны средства чтобы поддерживать ее в надлежащем состоянии(в многоквартирных домах это фиксированные платежи за квартиру, они называются maintenance)...";"...Насколько я вижу, в России сейчас не самая замечательная инвестиционная картина.﻿ В Америке же частная собственность не подлежит люстрации. В долгосрочной персрективе недвижимость всегда будет стоить больше...";"--SofiaHome что значит вкладываются? Для перепродажи? У вас жильё дорожает?--
Сейчас перепродать трудновато - цены не растут, ну если только в Нью-Йорке.  Просто люди размещают деньги. Конечно я не могу говорить за всех﻿ сразу - у каждого человека своя ситуация...";"eto y vas tak a v USA﻿ sovsem ne tak stoemost otsenyaetsa 

 Ya sam bevshei moskvech ya znau vse prevosxodno V Anereke yje 20 let . Bel ranshe brokerom , Toje vse prevosxodno ponemau ."
"xSAEJp4IzAA";"В России дети на улице! Выселение по ипотеке.";"На днях на площади Салавата Юлаева в Уфе жители города могли видеть одиноко стоящую женщину с плакатом. Ее семья в ближайшее время может оказаться на улице из-за неуплаты ипотечного кредита. На многочисленных совещаниях и форумах (взять тот же 5-й Всероссийский форум матерей) сегодня широко обсуждаются проблемы материнства и детства, необходимость укрепления института семьи и поддержки многодетных семей. Вместе с тем зачастую судьбы рядовых граждан остаются за пределами внимания высоких съездов. «Моя семья находится в тяжелой жизненной ситуации, но властям до нас нет дела. Нас выгоняют из ипотечной квартиры, -- поделилась своей проблемой уфимка Людмила Кузнецова. -- 23 ноября будет решение суда, после которого меня и моих детей выгонят на улицу. А это единственное наше жилье. Я стою здесь и пытаюсь докричаться до властей». В 2007 году семья Кузнецовых взяла ипотечный кредит в банке и на эти средства приобрела двухкомнатную квартиру. Но с началом кризиса отцу семейства вдвое урезали зарплату, а супруга не могла работать, поскольку ждала третьего ребенка. В итоге задолженность по кредиту стала расти и после трех месяцев просроченных платежей банк подал исковое заявление в суд. «Все спорные вопросы банк решает в установленном законодательством порядке, -- прокомментировали сайту Ufa1.ru в пресс-службе банка «ВТБ 24», который обслуживает ипотеку семьи Кузнецовых. -- Наш банк действительно обратился в суд для взыскания задолженности по кредитному договору и обращении взыскания <b>...</b>";"18/11/2011";4.0;"http://i.ytimg.com/vi/xSAEJp4IzAA/hqdefault.jpg";207;1787;"покупка квартиры в москве";"А ещё и налог﻿ за бездетность думают ввести или нет.Чинуши ебаные ВЫ ЧЁ СУКИ ВАЩЕ АХУЕЛИ?!";"webhata.ru Рынок Недвижимости России. Покупка,﻿ Продажа, Аренда.﻿﻿";"дима прав, 3 его зачем? Одного воспитать лучше качественно, чем 3 их хуй знает﻿ как, сломав им жизнь.";"слышь дима, ты сам то чего в жизни добился? Люди семью создали. А к тебе вообще жалости нет, если для тебя маленькие -не люди, паразит﻿ ты.";"пора коммунизм возвращать в﻿ страну";"Пиздец! Ну﻿ и Путин";"Блядь ну как можно заводить 3-го, взяв такую ипотеку??? Ладно баба она не понимает, но муж чем думал?? тем, чем детей делает или чем вообще? Хорошо, если квартиру отберут и вы еще ничего должны не останитесь,﻿ а если не так то всё писец !!!";"Спасибо путину вы за него голосовали получайте﻿ мрази!";"Сочувствую только детям, и то что у них родители идиоты. Неужели взяв ОГРОМНУЮ (или им она таковой не кажется) сумму денег было трудно обезопасить себя (а главное ДЕТЕЙ) и﻿ отложить несколько ежемесячных платежей. Да и никто вас на улицу не выселит. Общежития в каждом городе есть.";"Я нищий учитель, скоро тоже меня и мою семью выкинут за неуплату. Целыми днями работаю в школе, но зарплаты﻿ не хватает даже на питание. Долги выросли огромные.";"БДЯ СУКИ ЕБАНОЕ ГОСУРАРСТВО ЧТО БЫ ВЫ ЧИНОВНИКИ СУКИ ВСЕ ТАК ЖЕ МЁРЗЛИ﻿ НА МОРОЗЕ ЧТО БЫ ВЫ БЛЯДИ ВСЕ ОХУЕЛИ ... БЕДНЫЕ ДЕТИ...";"В германии немцы работают﻿ а у нас задницы просижывают.";"в германии часть этого долга берет на себя государство!!! а у нас государство это алигорхия а ей﻿ насрать на эту семью с ее проблемами!!!!";"Квартира в вашем городе за 200 тыс.руб! Вкладываем в МММ﻿ 2011 сроком на три месяца под 30-45% в месяц!2.Получаем прибыль! Ждём следующего года для получения квартиры!Условия:Деньги ( от 200 тыс.руб) должны быть внесены минимум на три месяца!- Деньги должны быть внесены именно в структуру десятника Данила Маликова,контактные данные Скайп:INTERCORPORATION, ICQ: 634-253-251.Срок действия до 10 февраля 2012 года!Акция будет действовать, если существование пирамиды не прекратится до 1 мая 2013 года!"
"fHhu5z5vlew";"ДИЗАЙН КВАРТИР В МОСКВЕ";"Дизайн интерьеров коттеджей и квартир. Дизайн - проект квартиры, коттеджа. Архитектор Кирилл Бескибалов. [[больше видео на моем канале!]] РИСУНОК, фотографии, ПРЕЗЕНТАЦИЯ. Таунхаус, дом, квартира, коттеджный поселок, жилой комплекс, евроремонт, авторский дизайн, дизайнер, МОСКВА, Московская область, новая рига, Новорижское, Рублевское, Ильинское шоссе. Поиск и разработка месторождений недвижимости в России.";"26/12/2012";5;"http://i.ytimg.com/vi/fHhu5z5vlew/hqdefault.jpg";130;105;"покупка квартиры в москве"
